idx,street_no,street_name,postal_code,city,province,address
18,4815,51 ave,T7N1M1,barrhead,alberta,"4815, 51 ave, barrhead, alberta"
33,,,T9N2J7,bonnyville,alberta,"bonnyville, alberta"
37,1100,hospital place,T1W1N2,canmore,alberta,"1100, hospital place, canmore, alberta"
43,4607,53 street,T4V1Y5,camrose,alberta,"4607, 53 street, camrose, alberta"
62,50a,avenue,T4N4E7,red deer,alberta,"50a, avenue, red deer, alberta"
103,3915,56 avenue,T9V1N9,lloydminster,alberta,"3915, 56 avenue, lloydminster, alberta"
132,7,hospital street,T9H1P2,fort mcmurray,alberta,"7, hospital street, fort mcmurray, alberta"
133,9401,86 avenue,T8L0C6,fort saskatchewan,alberta,"9401, 86 avenue, fort saskatchewan, alberta"
143,,10409-98 street,T8V2E8,grande prairie,alberta,"10409-98 street, grande prairie, alberta"
154,560,9 avenue w,T1V1B3,high river,alberta,"560, 9 avenue w, high river, alberta"
157,1280,switzer dr,T7V1V2,hinton,alberta,"1280, switzer dr, hinton, alberta"
164,960,19 street,T1J1W5,lethbridge,alberta,"960, 19 street, lethbridge, alberta"
179,7402,29 street,T9V3N1,lloydminster,alberta,"7402, 29 street, lloydminster, alberta"
185,,666-5 street sw,T1A4H6,medicine hat,alberta,"666-5 street sw, medicine hat, alberta"
207,10101,68 street,T8S1T6,peace river,alberta,"10101, 68 street, peace river, alberta"
236,1820,richmond road sw,T2T5C7,calgary,alberta,"1820, richmond road sw, calgary, alberta"
262,4448,front street se,T3M1M4,calgary,alberta,"4448, front street se, calgary, alberta"
317,881,mistassiniy road,T0G2K0,wabasca,alberta,"881, mistassiniy road, wabasca, alberta"
333,1629,115 ave,V1G3C7,dawson creek,british-columbia,"1629, 115 ave, dawson creek, british-columbia"
334,5145,11a ave,V4M1Z7,delta,british-columbia,"5145, 11a ave, delta, british-columbia"
335,1220,14 st e,V7J1K2,north vancouver,british-columbia,"1220, 14 st e, north vancouver, british-columbia"
336,22229,122 ave,V2X3X8,maple ridge,british-columbia,"22229, 122 ave, maple ridge, british-columbia"
337,108-2777,gladwin road,V2T4V1,abbotsford,british-columbia,"108-2777, gladwin road, abbotsford, british-columbia"
338,20878,123 ave,V2X4B2,maple ridge,british-columbia,"20878, 123 ave, maple ridge, british-columbia"
339,13333,20 ave,V4A1Z3,surrey,british-columbia,"13333, 20 ave, surrey, british-columbia"
340,1416,102 ave,V1G2C9,dawson creek,british-columbia,"1416, 102 ave, dawson creek, british-columbia"
341,4200,17 st,V1T8R7,vernon,british-columbia,"4200, 17 st, vernon, british-columbia"
342,1985,treelane rd,V9W4G1,campbell river,british-columbia,"1985, treelane rd, campbell river, british-columbia"
343,1990,treelane rd,V9W4E8,campbell river,british-columbia,"1990, treelane rd, campbell river, british-columbia"
344,8983,216a st,V1M4C7,langley,british-columbia,"8983, 216a st, langley, british-columbia"
345,12775,227 st,V2X6K5,maple ridge,british-columbia,"12775, 227 st, maple ridge, british-columbia"
346,2980,25 ave ne,V1E3C7,salmon arm,british-columbia,"2980, 25 ave ne, salmon arm, british-columbia"
347,404,29 st,V1N3T9,castlegar,british-columbia,"404, 29 st, castlegar, british-columbia"
348,1201,30 st ne,V1E2B6,salmon arm,british-columbia,"1201, 30 st ne, salmon arm, british-columbia"
349,3381,worthington dr,V5M3X8,vancouver,british-columbia,"3381, worthington dr, vancouver, british-columbia"
350,902,35 ave,V1T2R3,vernon,british-columbia,"902, 35 ave, vernon, british-columbia"
351,461,e 38 ave,V5W1H8,vancouver,british-columbia,"461, e 38 ave, vancouver, british-columbia"
352,1759,e 47 ave,V5P1P6,vancouver,british-columbia,"1759, e 47 ave, vancouver, british-columbia"
353,2304,4 st n,V1C5V9,cranbrook,british-columbia,"2304, 4 st n, cranbrook, british-columbia"
354,29172,58 ave,V4X2G1,abbotsford,british-columbia,"29172, 58 ave, abbotsford, british-columbia"
355,5960,angus pl,V3S4W7,surrey,british-columbia,"5960, angus pl, surrey, british-columbia"
356,5984,191a st,V3S7N1,surrey,british-columbia,"5984, 191a st, surrey, british-columbia"
357,6655,arlington st,V5S3P1,vancouver,british-columbia,"6655, arlington st, vancouver, british-columbia"
358,6699,arlington st,V5S3P1,vancouver,british-columbia,"6699, arlington st, vancouver, british-columbia"
359,322,7 street s,V1C1M7,cranbrook,british-columbia,"322, 7 street s, cranbrook, british-columbia"
360,23124,88 ave,V1M2R4,langley,british-columbia,"23124, 88 ave, langley, british-columbia"
361,917,foster ave,V3J2L8,coquitlam,british-columbia,"917, foster ave, coquitlam, british-columbia"
362,8704,92a st,V1J3J6,fort st john,british-columbia,"8704, 92a st, fort st john, british-columbia"
363,9511,steveston hwy,V7A1M7,richmond,british-columbia,"9511, steveston hwy, richmond, british-columbia"
364,1625,95 ave,V1G1K2,dawson creek,british-columbia,"1625, 95 ave, dawson creek, british-columbia"
367,302-2050,sumas way,V2S2C7,abbotsford,british-columbia,"302-2050, sumas way, abbotsford, british-columbia"
368,7109,westholme rd,V9L6B4,duncan,british-columbia,"7109, westholme rd, duncan, british-columbia"
369,2855,gladwin road,V2T6Y4,abbotsford,british-columbia,"2855, gladwin road, abbotsford, british-columbia"
371,56-2991,lougheed highway,V3B6J6,coquitlam,british-columbia,"56-2991, lougheed highway, coquitlam, british-columbia"
372,2655,shawnigan lake rd e,V0R2W0,shawnigan lake,british-columbia,"2655, shawnigan lake rd e, shawnigan lake, british-columbia"
373,1325,summit ave,V8J4C1,prince rupert,british-columbia,"1325, summit ave, prince rupert, british-columbia"
374,1745,adanac st,V8R2C4,victoria,british-columbia,"1745, adanac st, victoria, british-columbia"
375,851,boundary rd,V5K4T2,vancouver,british-columbia,"851, boundary rd, vancouver, british-columbia"
376,948,howard ave,V5B3R6,burnaby,british-columbia,"948, howard ave, burnaby, british-columbia"
377,1525,mackay cres,V0M1A3,agassiz,british-columbia,"1525, mackay cres, agassiz, british-columbia"
898,7195,canada way,V5E3R7,burnaby,british-columbia,"7195, canada way, burnaby, british-columbia"
379,5216,airport drive,V0C1R0,fort nelson,british-columbia,"5216, airport drive, fort nelson, british-columbia"
782,4411,wallace st,V9Y7Y5,port alberni,british-columbia,"4411, wallace st, port alberni, british-columbia"
382,4349,victoria dr,V5N4M9,vancouver,british-columbia,"4349, victoria dr, vancouver, british-columbia"
383,277,evergreen road,V9W5Y4,campbell river,british-columbia,"277, evergreen road, campbell river, british-columbia"
384,2-575b,alder avenue,V0K2E1,100 mile house,british-columbia,"2-575b, alder avenue, 100 mile house, british-columbia"
385,1561,alexis ave,V2B4L1,kamloops,british-columbia,"1561, alexis ave, kamloops, british-columbia"
386,3668,alfred ave,V0J2N0,smithers,british-columbia,"3668, alfred ave, smithers, british-columbia"
387,2724,alice lake pl,V3C5W8,coquitlam,british-columbia,"2724, alice lake pl, coquitlam, british-columbia"
1501,2269,mills rd,V8L2C3,sidney,british-columbia,"2269, mills rd, sidney, british-columbia"
389,102-2752,allwood street,V2T3R7,abbotsford,british-columbia,"102-2752, allwood street, abbotsford, british-columbia"
390,3762,thurston st,V5H1H7,burnaby,british-columbia,"3762, thurston st, burnaby, british-columbia"
391,842,pears rd,V9C4A2,victoria,british-columbia,"842, pears rd, victoria, british-columbia"
392,2316,amelia ave,V8L2H6,sidney,british-columbia,"2316, amelia ave, sidney, british-columbia"
394,3225,highland blvd,V7R0A3,north vancouver,british-columbia,"3225, highland blvd, north vancouver, british-columbia"
395,50,douglas st,V8V2N8,victoria,british-columbia,"50, douglas st, victoria, british-columbia"
396,701,keith rd,V7T1M2,west vancouver,british-columbia,"701, keith rd, west vancouver, british-columbia"
397,994,gorge rd w,V9A1P2,victoria,british-columbia,"994, gorge rd w, victoria, british-columbia"
398,659,clyde ave,V7T1C8,west vancouver,british-columbia,"659, clyde ave, west vancouver, british-columbia"
399,15333,16 ave,V4A1R6,surrey,british-columbia,"15333, 16 ave, surrey, british-columbia"
400,1249,e 8 ave,V5T1V3,vancouver,british-columbia,"1249, e 8 ave, vancouver, british-columbia"
401,108-402,baker street,V1L4H8,nelson,british-columbia,"108-402, baker street, nelson, british-columbia"
403,710,applegate rd,V9W7A2,campbell river,british-columbia,"710, applegate rd, campbell river, british-columbia"
404,162-1848,main street,V2A5H3,penticton,british-columbia,"162-1848, main street, penticton, british-columbia"
405,6408,dover rd,V9V1A7,nanaimo,british-columbia,"6408, dover rd, nanaimo, british-columbia"
406,202-179,davie street,V6Z2Y1,vancouver,british-columbia,"202-179, davie street, vancouver, british-columbia"
407,27136,112 ave,V2W1P8,maple ridge,british-columbia,"27136, 112 ave, maple ridge, british-columbia"
408,17,baden powell st,V9G1A3,ladysmith,british-columbia,"17, baden powell st, ladysmith, british-columbia"
409,3114,irma st,V9A1S8,victoria,british-columbia,"3114, irma st, victoria, british-columbia"
410,101-32555,simon avenue,V2T4Y2,abbotsford,british-columbia,"101-32555, simon avenue, abbotsford, british-columbia"
411,5933,168 st,V3S3X5,surrey,british-columbia,"5933, 168 st, surrey, british-columbia"
412,14590,106a ave,V3R1T4,surrey,british-columbia,"14590, 106a ave, surrey, british-columbia"
414,266,moilliet st,V9P1M9,parksville,british-columbia,"266, moilliet st, parksville, british-columbia"
417,32885,ashley way,V2S5W3,abbotsford,british-columbia,"32885, ashley way, abbotsford, british-columbia"
418,3865,hwy 3,V0X1N1,keremeos,british-columbia,"3865, hwy 3, keremeos, british-columbia"
419,15625,aster rd,V4A1Y4,surrey,british-columbia,"15625, aster rd, surrey, british-columbia"
420,3820,arthur dr,V4K5E6,delta,british-columbia,"3820, arthur dr, delta, british-columbia"
421,100-5581,204 street,V3A1Z4,langley,british-columbia,"100-5581, 204 street, langley, british-columbia"
422,4989,wills rd,V9T2K4,nanaimo,british-columbia,"4989, wills rd, nanaimo, british-columbia"
423,1658,blondeaux crescent,V1Y4J7,kelowna,british-columbia,"1658, blondeaux crescent, kelowna, british-columbia"
424,2528,columbia ave,V1N2X5,castlegar,british-columbia,"2528, columbia ave, castlegar, british-columbia"
425,1700,renner rd,V2G3B3,williams lake,british-columbia,"1700, renner rd, williams lake, british-columbia"
426,6764,ayre rd,V9Z1K1,sooke,british-columbia,"6764, ayre rd, sooke, british-columbia"
427,6531,azure rd,V7C2S1,richmond,british-columbia,"6531, azure rd, richmond, british-columbia"
429,18919,62a ave,V3S8S4,surrey,british-columbia,"18919, 62a ave, surrey, british-columbia"
431,2785,ash st,V5Z1M9,vancouver,british-columbia,"2785, ash st, vancouver, british-columbia"
432,8590,bannister dr,V2V5X4,mission,british-columbia,"8590, bannister dr, mission, british-columbia"
433,4134,rupert st,V5R2H4,vancouver,british-columbia,"4134, rupert st, vancouver, british-columbia"
1570,700,rutland rd n,V1X7W8,kelowna,british-columbia,"700, rutland rd n, kelowna, british-columbia"
1629,3814,carey rd,V8Z4C4,victoria,british-columbia,"3814, carey rd, victoria, british-columbia"
1645,2425,orlin rd,V4T3C7,west kelowna,british-columbia,"2425, orlin rd, west kelowna, british-columbia"
438,1440,barberry dr,V3B1G3,port coquitlam,british-columbia,"1440, barberry dr, port coquitlam, british-columbia"
439,1948,grant ave,V3B1P7,port coquitlam,british-columbia,"1948, grant ave, port coquitlam, british-columbia"
440,1240,barlynn crescent,V7J1P6,north vancouver,british-columbia,"1240, barlynn crescent, north vancouver, british-columbia"
441,485,carlstrom rd,V0E1E0,barriere,british-columbia,"485, carlstrom rd, barriere, british-columbia"
443,44419,bayshore ave,V2R0A5,chilliwack,british-columbia,"44419, bayshore ave, chilliwack, british-columbia"
446,4500,oak street,V6H3N1,vancouver,british-columbia,"4500, oak street, vancouver, british-columbia"
498,1167,stellys x rd,V8M1H4,brentwood bay,british-columbia,"1167, stellys x rd, brentwood bay, british-columbia"
449,635,superior st,V8V1V1,victoria,british-columbia,"635, superior st, victoria, british-columbia"
450,530,simcoe st,V8V4W4,victoria,british-columbia,"530, simcoe st, victoria, british-columbia"
451,12032,216 st,V2X5J3,maple ridge,british-columbia,"12032, 216 st, maple ridge, british-columbia"
452,910,easter rd,V8X2Z8,victoria,british-columbia,"910, easter rd, victoria, british-columbia"
453,88,waglisla street,V0T1Z0,bella bella,british-columbia,"88, waglisla street, bella bella, british-columbia"
455,1025,elcho street,V0T1C0,bella coola,british-columbia,"1025, elcho street, bella coola, british-columbia"
456,3975,202 st,V3A1R9,langley,british-columbia,"3975, 202 st, langley, british-columbia"
596,13453,111a ave,V3R2C5,surrey,british-columbia,"13453, 111a ave, surrey, british-columbia"
459,2444,burr pl,V7H3A5,north vancouver,british-columbia,"2444, burr pl, north vancouver, british-columbia"
460,1400,lakewood dr,V5L4M8,vancouver,british-columbia,"1400, lakewood dr, vancouver, british-columbia"
461,4062,shelbourne st,V8N3E6,victoria,british-columbia,"4062, shelbourne st, victoria, british-columbia"
462,3201,ross rd,V9T6L9,nanaimo,british-columbia,"3201, ross rd, nanaimo, british-columbia"
463,60,whiteshield crescent s,V2E2S9,kamloops,british-columbia,"60, whiteshield crescent s, kamloops, british-columbia"
464,4680,elk lake dr,V8Z5M1,victoria,british-columbia,"4680, elk lake dr, victoria, british-columbia"
465,17412,58a ave,V3S1M8,surrey,british-columbia,"17412, 58a ave, surrey, british-columbia"
466,1895,jackson st,V2S2Z8,abbotsford,british-columbia,"1895, jackson st, abbotsford, british-columbia"
467,32704,chilcotin dr,V2T5S5,abbotsford,british-columbia,"32704, chilcotin dr, abbotsford, british-columbia"
468,32553,willingdon cres,V2T1S1,abbotsford,british-columbia,"32553, willingdon cres, abbotsford, british-columbia"
469,20477,93a ave,V1M1B8,langley,british-columbia,"20477, 93a ave, langley, british-columbia"
470,32768,bevan ave,V2S1T1,abbotsford,british-columbia,"32768, bevan ave, abbotsford, british-columbia"
471,7540,acheson road,V6Y1M9,richmond,british-columbia,"7540, acheson road, richmond, british-columbia"
472,10984,springmont gate,V7E1Y4,richmond,british-columbia,"10984, springmont gate, richmond, british-columbia"
473,16321,108 ave,V3R6C5,surrey,british-columbia,"16321, 108 ave, surrey, british-columbia"
474,31126,kingfisher dr,V2T5K4,abbotsford,british-columbia,"31126, kingfisher dr, abbotsford, british-columbia"
475,2339,arbutus st,V2T2V8,abbotsford,british-columbia,"2339, arbutus st, abbotsford, british-columbia"
476,10120,no 1 road,V7E1S2,richmond,british-columbia,"10120, no 1 road, richmond, british-columbia"
477,33386,bevan ave,V2S5G6,abbotsford,british-columbia,"33386, bevan ave, abbotsford, british-columbia"
478,201-2763,beverly street,V9L6X2,duncan,british-columbia,"201-2763, beverly street, duncan, british-columbia"
479,101-19211,fraser highway,V3S7C9,surrey,british-columbia,"101-19211, fraser highway, surrey, british-columbia"
480,7446,highway 6,V1B3H4,coldstream,british-columbia,"7446, highway 6, coldstream, british-columbia"
481,5100,blundell rd,V7C1H4,richmond,british-columbia,"5100, blundell rd, richmond, british-columbia"
482,7780,hart hwy,V2K3B3,prince george,british-columbia,"7780, hart hwy, prince george, british-columbia"
483,4002,maple crescent,V6J4B2,vancouver,british-columbia,"4002, maple crescent, vancouver, british-columbia"
484,3183,kofoed dr,V8G3P8,thornhill,british-columbia,"3183, kofoed dr, thornhill, british-columbia"
485,625,bissette road,V2B6L3,kamloops,british-columbia,"625, bissette road, kamloops, british-columbia"
486,3263,blenheim st,V6L2X7,vancouver,british-columbia,"3263, blenheim st, vancouver, british-columbia"
487,3924,blenkinsop rd,V8P3P5,victoria,british-columbia,"3924, blenkinsop rd, victoria, british-columbia"
488,2669,standish dr,V7H1M9,north vancouver,british-columbia,"2669, standish dr, north vancouver, british-columbia"
489,452,borland street,V2G1R7,williams lake,british-columbia,"452, borland street, williams lake, british-columbia"
492,115-6350,120 street,V3X3K1,surrey,british-columbia,"115-6350, 120 street, surrey, british-columbia"
493,4909,bowness avenue,V8A3S6,powell river,british-columbia,"4909, bowness avenue, powell river, british-columbia"
495,3098,bradner rd,V4X1K2,abbotsford,british-columbia,"3098, bradner rd, abbotsford, british-columbia"
496,2402,s main st,V2A5H9,penticton,british-columbia,"2402, s main st, penticton, british-columbia"
497,2081,cross road,V1V2G2,kelowna,british-columbia,"2081, cross road, kelowna, british-columbia"
499,212-4567,lougheed highway,V5C3Z6,burnaby,british-columbia,"212-4567, lougheed highway, burnaby, british-columbia"
500,150-17475,56 avenue,V3S2X6,surrey,british-columbia,"150-17475, 56 avenue, surrey, british-columbia"
501,1435,e 19 ave,V5N2H9,vancouver,british-columbia,"1435, e 19 ave, vancouver, british-columbia"
502,229,22 st w,V7M2A2,north vancouver,british-columbia,"229, 22 st w, north vancouver, british-columbia"
503,1090,victoria dr,V5L4G2,vancouver,british-columbia,"1090, victoria dr, vancouver, british-columbia"
505,4755,victoria dr,V5N4P2,vancouver,british-columbia,"4755, victoria dr, vancouver, british-columbia"
506,1377,lameys mill rd,V6H3S9,vancouver,british-columbia,"1377, lameys mill rd, vancouver, british-columbia"
507,2516,commercial drive,V5N4C2,vancouver,british-columbia,"2516, commercial drive, vancouver, british-columbia"
508,1015,springboard pl,V9B3E2,victoria,british-columbia,"1015, springboard pl, victoria, british-columbia"
509,1955,tranquille rd,V2B3M4,kamloops,british-columbia,"1955, tranquille rd, kamloops, british-columbia"
512,19550,fraser hwy,V3S6K5,surrey,british-columbia,"19550, fraser hwy, surrey, british-columbia"
513,3830,200 st,V3A1K2,langley,british-columbia,"3830, 200 st, langley, british-columbia"
514,1820,marshall st,V1Y2B7,kelowna,british-columbia,"1820, marshall st, kelowna, british-columbia"
515,146,bruce court,V2A6C4,penticton,british-columbia,"146, bruce court, penticton, british-columbia"
516,19665,55a ave,V3A3X1,langley,british-columbia,"19665, 55a ave, langley, british-columbia"
517,7516,imperial st,V5E1P6,burnaby,british-columbia,"7516, imperial st, burnaby, british-columbia"
518,15109,buena vista ave,V4B1Y2,white rock,british-columbia,"15109, buena vista ave, white rock, british-columbia"
519,3668,11 ave,V0J2N0,smithers,british-columbia,"3668, 11 ave, smithers, british-columbia"
521,3338,burde st,V9Y0A5,port alberni,british-columbia,"3338, burde st, port alberni, british-columbia"
522,1680,burden st,V2M2J8,prince george,british-columbia,"1680, burden st, prince george, british-columbia"
524,101,burnside w,V9A1B7,victoria,british-columbia,"101, burnside w, victoria, british-columbia"
525,595,burnside rd w,V8Z1M7,victoria,british-columbia,"595, burnside rd w, victoria, british-columbia"
905,415,haven hill rd,V2A4E9,penticton,british-columbia,"415, haven hill rd, penticton, british-columbia"
530,551,e 16 ave,V5T2V1,vancouver,british-columbia,"551, e 16 ave, vancouver, british-columbia"
531,510,25 st w,V7N2G3,north vancouver,british-columbia,"510, 25 st w, north vancouver, british-columbia"
532,6473,cabeldu cres,V4E1R2,delta,british-columbia,"6473, cabeldu cres, delta, british-columbia"
534,6010,brickyard road,V9V1S5,nanaimo,british-columbia,"6010, brickyard road, nanaimo, british-columbia"
535,5,w 15 ave,V5Y1X7,vancouver,british-columbia,"5, w 15 ave, vancouver, british-columbia"
536,4057,campbell ave,V2M5A3,prince george,british-columbia,"4057, campbell ave, prince george, british-columbia"
537,20139,telep ave,V2X3M4,maple ridge,british-columbia,"20139, telep ave, maple ridge, british-columbia"
538,21351,campbell ave,V2X7G6,maple ridge,british-columbia,"21351, campbell ave, maple ridge, british-columbia"
541,346,campbell st,V9L3H8,duncan,british-columbia,"346, campbell st, duncan, british-columbia"
542,6631,camsell cres,V7C2M9,richmond,british-columbia,"6631, camsell cres, richmond, british-columbia"
543,1908,110 ave,V1G2W7,dawson creek,british-columbia,"1908, 110 ave, dawson creek, british-columbia"
544,4695,canada way,V5G1K8,burnaby,british-columbia,"4695, canada way, burnaby, british-columbia"
545,525,clyde avenue,V7T1C4,west vancouver,british-columbia,"525, clyde avenue, west vancouver, british-columbia"
546,4410,capilano road,V7R4J9,north vancouver,british-columbia,"4410, capilano road, north vancouver, british-columbia"
547,4537,capilano rd,V7R4K2,north vancouver,british-columbia,"4537, capilano rd, north vancouver, british-columbia"
548,547,caramillo ct,V1V2K9,kelowna,british-columbia,"547, caramillo ct, kelowna, british-columbia"
549,1623,commercial drive,V5L3Y3,vancouver,british-columbia,"1623, commercial drive, vancouver, british-columbia"
550,101-1277,marine drive,V7P1T3,north vancouver,british-columbia,"101-1277, marine drive, north vancouver, british-columbia"
552,2929,barnet highway,V3B5R5,coquitlam,british-columbia,"2929, barnet highway, coquitlam, british-columbia"
553,306-9014,152 street,V3R4E7,surrey,british-columbia,"306-9014, 152 street, surrey, british-columbia"
554,4241,carey rd,V8Z4H1,victoria,british-columbia,"4241, carey rd, victoria, british-columbia"
558,185,4 ave n,V2G2C8,williams lake,british-columbia,"185, 4 ave n, williams lake, british-columbia"
559,4108,norfolk st,V5G0B4,burnaby,british-columbia,"4108, norfolk st, burnaby, british-columbia"
560,2524,carnation street,V7H1H5,north vancouver,british-columbia,"2524, carnation street, north vancouver, british-columbia"
561,4096,carolina st,V5V4B7,vancouver,british-columbia,"4096, carolina st, vancouver, british-columbia"
562,5155,carson st,V5J2Z1,burnaby,british-columbia,"5155, carson st, burnaby, british-columbia"
563,1419,cartier ave,V3K2C6,coquitlam,british-columbia,"1419, cartier ave, coquitlam, british-columbia"
564,4024,livingstone ave n,V8N5Z5,victoria,british-columbia,"4024, livingstone ave n, victoria, british-columbia"
565,1647,caspers way,V9S1K2,nanaimo,british-columbia,"1647, caspers way, nanaimo, british-columbia"
566,3405,4 ave,V1N2T4,castlegar,british-columbia,"3405, 4 ave, castlegar, british-columbia"
567,2300,14 ave,V1N4A6,castlegar,british-columbia,"2300, 14 ave, castlegar, british-columbia"
568,809,catherine ave,V3J4L6,coquitlam,british-columbia,"809, catherine ave, coquitlam, british-columbia"
569,220-5317,headland drive,V7W3C5,west vancouver,british-columbia,"220-5317, headland drive, west vancouver, british-columbia"
570,635,25 avenue s,V0B1G0,creston,british-columbia,"635, 25 avenue s, creston, british-columbia"
571,901,erickson st,V0B1G3,creston,british-columbia,"901, erickson st, creston, british-columbia"
572,535,18 ave s,V0B1G3,creston,british-columbia,"535, 18 ave s, creston, british-columbia"
573,104-32423,lougheed highway,V2V7B8,mission,british-columbia,"104-32423, lougheed highway, mission, british-columbia"
574,3741,holland ave,V0R1L0,cobble hill,british-columbia,"3741, holland ave, cobble hill, british-columbia"
575,23635,118 ave,V4R2C9,maple ridge,british-columbia,"23635, 118 ave, maple ridge, british-columbia"
576,1200,cedar village close,V7J3P3,north vancouver,british-columbia,"1200, cedar village close, north vancouver, british-columbia"
577,10130,159a st,V4N2P8,surrey,british-columbia,"10130, 159a st, surrey, british-columbia"
578,415,w pender st,V6B1V2,vancouver,british-columbia,"415, w pender st, vancouver, british-columbia"
579,2035,ethel st,V1Y2Z6,kelowna,british-columbia,"2035, ethel st, kelowna, british-columbia"
580,6661,central saanich rd,V8Z5V1,saanichton,british-columbia,"6661, central saanich rd, saanichton, british-columbia"
581,1932,mount newton cross road,V8M2B1,saanichton,british-columbia,"1932, mount newton cross road, saanichton, british-columbia"
582,3243,cowichan lake rd,V9L4B8,duncan,british-columbia,"3243, cowichan lake rd, duncan, british-columbia"
583,7400,sunshine dr,V2R1H6,chilliwack,british-columbia,"7400, sunshine dr, chilliwack, british-columbia"
584,2810,e 51 ave,V5S1R3,vancouver,british-columbia,"2810, e 51 ave, vancouver, british-columbia"
586,4491,sunshine coast highway,V0N3A1,sechelt,british-columbia,"4491, sunshine coast highway, sechelt, british-columbia"
587,3363,charles st,V5K3C3,vancouver,british-columbia,"3363, charles st, vancouver, british-columbia"
588,6845,kitchener st,V5B2J8,burnaby,british-columbia,"6845, kitchener st, burnaby, british-columbia"
589,100,eleventh st,V9R6R6,nanaimo,british-columbia,"100, eleventh st, nanaimo, british-columbia"
664,1222,king george blvd,V4A9W6,surrey,british-columbia,"1222, king george blvd, surrey, british-columbia"
1041,8888,202 st,V1M4A7,langley,british-columbia,"8888, 202 st, langley, british-columbia"
594,4544,216 st,V3A2M4,langley,british-columbia,"4544, 216 st, langley, british-columbia"
597,5328,chester st,V5W3A9,vancouver,british-columbia,"5328, chester st, vancouver, british-columbia"
598,4576,55b st,V4K3W5,delta,british-columbia,"4576, 55b st, delta, british-columbia"
602,5125,50 street sw,V0C1J0,chetwynd,british-columbia,"5125, 50 street sw, chetwynd, british-columbia"
608,6980,vedder rd,V2R4E1,chilliwack,british-columbia,"6980, vedder rd, chilliwack, british-columbia"
609,3501,paradise valley rd,V0N1T0,squamish,british-columbia,"3501, paradise valley rd, squamish, british-columbia"
610,11753,82 ave,V4C2C3,delta,british-columbia,"11753, 82 ave, delta, british-columbia"
611,585,shaw road,V0N1V8,gibsons,british-columbia,"585, shaw road, gibsons, british-columbia"
612,1020,95 ave,V1G1J1,dawson creek,british-columbia,"1020, 95 ave, dawson creek, british-columbia"
613,110-13588,88 avenue,V3W3K8,surrey,british-columbia,"110-13588, 88 avenue, surrey, british-columbia"
614,3364,196 st,V3A4T7,langley,british-columbia,"3364, 196 st, langley, british-columbia"
615,204-18730,fraser highway,V3S7Y4,surrey,british-columbia,"204-18730, fraser highway, surrey, british-columbia"
616,875,clayton rd,V8L5M3,north saanich,british-columbia,"875, clayton rd, north saanich, british-columbia"
617,102-17770,56 avenue,V3S1C7,surrey,british-columbia,"102-17770, 56 avenue, surrey, british-columbia"
