idx,street_no,street_name,postal_code,city,province,address
2628,8720,willoughby drive,L2G7X3,niagara falls,ontario,"8720, willoughby drive, niagara falls, ontario"
2629,231,front street,K8N2Z4,belleville,ontario,"231, front street, belleville, ontario"
2630,161,bridge street w,K8P1K2,belleville,ontario,"161, bridge street w, belleville, ontario"
2631,175,brentcliffe road,M4G0C5,toronto,ontario,"175, brentcliffe road, toronto, ontario"
2632,789,don mills road,M3C1T5,toronto,ontario,"789, don mills road, toronto, ontario"
2633,55,belmont street,M5R1R1,toronto,ontario,"55, belmont street, toronto, ontario"
2634,250,bridge street w,K8P5N3,belleville,ontario,"250, bridge street w, belleville, ontario"
2635,21,belvedere avenue,P2A2A2,parry sound,ontario,"21, belvedere avenue, parry sound, ontario"
2637,144,causley street,P0R1B0,blind river,ontario,"144, causley street, blind river, ontario"
2638,2920,lawrence avenue e,M1P2T8,toronto,ontario,"2920, lawrence avenue e, toronto, ontario"
2639,1,princess anne drive,L7G2B8,halton hills,ontario,"1, princess anne drive, halton hills, ontario"
2640,350,dougall avenue,N9A4P4,windsor,ontario,"350, dougall avenue, windsor, ontario"
2641,1003,steeles avenue w,M2R3T6,toronto,ontario,"1003, steeles avenue w, toronto, ontario"
2642,21,hatt street,L9H2E9,hamilton,ontario,"21, hatt street, hamilton, ontario"
2643,1107,french settlement road,K0G1J0,kemptville,ontario,"1107, french settlement road, kemptville, ontario"
2644,63,carrie street,P7A4J2,thunder bay,ontario,"63, carrie street, thunder bay, ontario"
2645,35,main street e,N0J1P0,norwich,ontario,"35, main street e, norwich, ontario"
2646,23,second street,L3R2C2,markham,ontario,"23, second street, markham, ontario"
2647,18,king street e,L7E1E8,caledon,ontario,"18, king street e, caledon, ontario"
2648,3,hillside drive,L9W1P5,orangeville,ontario,"3, hillside drive, orangeville, ontario"
2649,76,silversted drive,M1S3A5,toronto,ontario,"76, silversted drive, toronto, ontario"
2650,1,overland drive,M3C2C3,toronto,ontario,"1, overland drive, toronto, ontario"
2651,1,overland drive,M3C2C3,toronto,ontario,"1, overland drive, toronto, ontario"
2652,180,sheridan avenue,M6K3C7,toronto,ontario,"180, sheridan avenue, toronto, ontario"
2653,3700,billings court,L7N3N6,burlington,ontario,"3700, billings court, burlington, ontario"
2654,1180,belanger avenue,K1H8A2,ottawa,ontario,"1180, belanger avenue, ottawa, ontario"
2655,1370,bank street,K1H8N6,ottawa,ontario,"1370, bank street, ottawa, ontario"
2656,243,granville street,K1L6Z3,ottawa,ontario,"243, granville street, ottawa, ontario"
2658,146,court street s,P7B2X6,thunder bay,ontario,"146, court street s, thunder bay, ontario"
2659,234,bay street,L3V3W8,orillia,ontario,"234, bay street, orillia, ontario"
2660,237,lakeview drive,P9N4J7,kenora,ontario,"237, lakeview drive, kenora, ontario"
2661,16,birdsilver gardens,M1C4M5,toronto,ontario,"16, birdsilver gardens, toronto, ontario"
2662,611,farmstead drive,L9T7Y8,milton,ontario,"611, farmstead drive, milton, ontario"
2663,356,birmingham street e,N0G2L2,mount forest,ontario,"356, birmingham street e, mount forest, ontario"
2664,2202,jane street,M3M1A4,toronto,ontario,"2202, jane street, toronto, ontario"
2665,101,creighton road,L9H3B7,hamilton,ontario,"101, creighton road, hamilton, ontario"
2666,99,creighton road,L9H3B7,hamilton,ontario,"99, creighton road, hamilton, ontario"
2667,2412,cleroux crescent,K1W1A3,ottawa,ontario,"2412, cleroux crescent, ottawa, ontario"
2668,10,mary avenue,N0P1A0,chatham-kent,ontario,"10, mary avenue, chatham-kent, ontario"
2669,90,catherine street,N0P1A0,chatham-kent,ontario,"90, catherine street, chatham-kent, ontario"
2671,13621,ninth line,L4A3C8,whitchurch-stouffville,ontario,"13621, ninth line, whitchurch-stouffville, ontario"
2673,236,weir street,L0M1S0,stayner,ontario,"236, weir street, stayner, ontario"
2674,685,bloem street,P1B4Z7,north bay,ontario,"685, bloem street, north bay, ontario"
2675,37792,zurich-hensall road,N0M2T0,zurich,ontario,"37792, zurich-hensall road, zurich, ontario"
2676,43,main street,N0M2T0,zurich,ontario,"43, main street, zurich, ontario"
2678,450,blanche street,N0N1R0,petrolia,ontario,"450, blanche street, petrolia, ontario"
2683,1,royal parkside drive,L4M0C4,barrie,ontario,"1, royal parkside drive, barrie, ontario"
2684,1,bobier lane,N0L1J0,dutton,ontario,"1, bobier lane, dutton, ontario"
2685,3477,petawawa boulevard,K8H1X2,petawawa,ontario,"3477, petawawa boulevard, petawawa, ontario"
2686,470,albert street,K7V4L5,renfrew,ontario,"470, albert street, renfrew, ontario"
2687,1130,bough beeches boulevard,L4W4G3,mississauga,ontario,"1130, bough beeches boulevard, mississauga, ontario"
2688,105,queen street,L1C0T3,bowmanville,ontario,"105, queen street, bowmanville, ontario"
2689,184,horton street,N6B1K8,london,ontario,"184, horton street, london, ontario"
2690,2,edge street,N3T6H1,brantford,ontario,"2, edge street, brantford, ontario"
2691,2656,line 6,L3Z2A1,bradford west gwillimbury,ontario,"2656, line 6, bradford west gwillimbury, ontario"
2692,54,foxbar road,M4V2G6,toronto,ontario,"54, foxbar road, toronto, ontario"
2694,719,josephine street n,N0G2W0,wingham,ontario,"719, josephine street n, wingham, ontario"
2695,850,king street w,L1J8N5,oshawa,ontario,"850, king street w, oshawa, ontario"
2696,3340,schmon parkway,L2V4Y6,thorold,ontario,"3340, schmon parkway, thorold, ontario"
2697,225,king william street,L8R1B1,hamilton,ontario,"225, king william street, hamilton, ontario"
2698,426,balmoral street,P7C5G8,thunder bay,ontario,"426, balmoral street, thunder bay, ontario"
2699,21,essa road,L4N3K5,barrie,ontario,"21, essa road, barrie, ontario"
2700,40,finchgate boulevard,L6T3J1,brampton,ontario,"40, finchgate boulevard, brampton, ontario"
2701,30,peel centre drive,L6T4G8,brampton,ontario,"30, peel centre drive, brampton, ontario"
2703,111,hibernia street,K9A4Y7,cobourg,ontario,"111, hibernia street, cobourg, ontario"
2711,194,terrace hill street,N3R1G7,brantford,ontario,"194, terrace hill street, brantford, ontario"
2713,21,strickland avenue,M6K3E6,toronto,ontario,"21, strickland avenue, toronto, ontario"
2714,234,ste marie street,L9Y3K5,collingwood,ontario,"234, ste marie street, collingwood, ontario"
2715,1250,weber street e,N2A4E1,kitchener,ontario,"1250, weber street e, kitchener, ontario"
2716,4567,bath road,K7N1A8,amherstview,ontario,"4567, bath road, amherstview, ontario"
2717,430,broadview avenue,M4K2N1,toronto,ontario,"430, broadview avenue, toronto, ontario"
2719,1485,garrison road,L2A1P8,fort erie,ontario,"1485, garrison road, fort erie, ontario"
2720,1026,bridlewood drive,K6V7J8,brockville,ontario,"1026, bridlewood drive, brockville, ontario"
2721,480,brigitta street,K2S0K7,ottawa,ontario,"480, brigitta street, ottawa, ontario"
2722,425,park road n,N3R7G5,brantford,ontario,"425, park road n, brantford, ontario"
2723,210,brockville street,K7A3Z4,smiths falls,ontario,"210, brockville street, smiths falls, ontario"
2725,720,simcoe street,L0K1A0,beaverton,ontario,"720, simcoe street, beaverton, ontario"
2726,21,mcgivern street w,N0G2V0,walkerton,ontario,"21, mcgivern street w, walkerton, ontario"
2727,61,king street e,K6V1B2,brockville,ontario,"61, king street e, brockville, ontario"
2728,42,garden street,K6V2C3,brockville,ontario,"42, garden street, brockville, ontario"
2735,6449,perth road,K0H2L0,perth road,ontario,"6449, perth road, perth road, ontario"
2736,1000,elgin mills road,L4S1M4,richmond hill,ontario,"1000, elgin mills road, richmond hill, ontario"
2737,7835,confederation line,N0M2S0,watford,ontario,"7835, confederation line, watford, ontario"
2738,11900,brouillette court,N8N4X8,windsor,ontario,"11900, brouillette court, windsor, ontario"
2739,657,mount pleasant road,N0E1K0,brant,ontario,"657, mount pleasant road, brant, ontario"
2740,41,mcgivern street w,N0G2V0,walkerton,ontario,"41, mcgivern street w, walkerton, ontario"
2741,101,ontario,P0M1K0,chapleau,ontario,"101, ontario, chapleau, ontario"
2742,43,bruyere street,K1N5C8,ottawa,ontario,"43, bruyere street, ottawa, ontario"
2750,6257,main street,L4A4J3,whitchurch-stouffville,ontario,"6257, main street, whitchurch-stouffville, ontario"
2751,1500,ouellette avenue,N8X1K7,windsor,ontario,"1500, ouellette avenue, windsor, ontario"
2752,150,huston street,P0A1C0,burks falls,ontario,"150, huston street, burks falls, ontario"
2753,1221,lakeshore road,L7S0A1,burlington,ontario,"1221, lakeshore road, burlington, ontario"
2754,5959,new street,L7L6W5,burlington,ontario,"5959, new street, burlington, ontario"
2755,320,6 line e,K0L1L0,campbellford,ontario,"320, 6 line e, campbellford, ontario"
2756,5,sterritt drive,L6Y5P3,brampton,ontario,"5, sterritt drive, brampton, ontario"
2757,3,norm goodspeed drive,L9P0B7,uxbridge,ontario,"3, norm goodspeed drive, uxbridge, ontario"
2758,1355,bank street,K1H8K7,ottawa,ontario,"1355, bank street, ottawa, ontario"
2759,826,princess street,K7L1G3,kingston,ontario,"826, princess street, kingston, ontario"
2760,4984,calabogie road,K0J1H0,calabogie,ontario,"4984, calabogie road, calabogie, ontario"
2761,14,orange street,N8H1P5,leamington,ontario,"14, orange street, leamington, ontario"
2762,18,king street e,L7E1E8,caledon,ontario,"18, king street e, caledon, ontario"
2764,159,panin road,L7P5A6,burlington,ontario,"159, panin road, burlington, ontario"
2765,3680,speedsville road,N3H4R6,cambridge,ontario,"3680, speedsville road, cambridge, ontario"
2767,1001,queen street w,M6J1H4,toronto,ontario,"1001, queen street w, toronto, ontario"
2768,2250,hurontario street,L5B1M8,mississauga,ontario,"2250, hurontario street, mississauga, ontario"
2769,1119,bathgate drive,K1J9N4,ottawa,ontario,"1119, bathgate drive, ottawa, ontario"
2772,174,oliver road,K0L1L0,campbellford,ontario,"174, oliver road, campbellford, ontario"
2773,50,main street,N3L2E2,brant,ontario,"50, main street, brant, ontario"
2774,21,hunter street e,L8N1M2,hamilton,ontario,"21, hunter street e, hamilton, ontario"
2775,1300,bath road,K7M4X4,kingston,ontario,"1300, bath road, kingston, ontario"
2776,2197,riverside drive,K1H7X3,ottawa,ontario,"2197, riverside drive, ottawa, ontario"
2777,130,queen street e,P6A1Y5,sault ste marie,ontario,"130, queen street e, sault ste marie, ontario"
2778,1233,paris street,P3E3B6,sudbury,ontario,"1233, paris street, sudbury, ontario"
2779,125,syndicate avenue s,P7E6H8,thunder bay,ontario,"125, syndicate avenue s, thunder bay, ontario"
2780,470,dundas street e,K8N1G1,belleville,ontario,"470, dundas street e, belleville, ontario"
2781,44,king street,N3T3C7,brantford,ontario,"44, king street, brantford, ontario"
2782,663,rue principale,K0A1M0,casselman,ontario,"663, rue principale, casselman, ontario"
2783,20,may street s,P0J1P0,temiskaming shores,ontario,"20, may street s, temiskaming shores, ontario"
2784,60,bond street w,L1G1A5,oshawa,ontario,"60, bond street w, oshawa, ontario"
2785,110,centre street,N5R2Z9,saint thomas,ontario,"110, centre street, saint thomas, ontario"
2786,21,wolsley street,P9N3W7,kenora,ontario,"21, wolsley street, kenora, ontario"
2787,611,9 avenue e,N4K6Z4,owen sound,ontario,"611, 9 avenue e, owen sound, ontario"
2788,415,water street,K9H3L9,peterborough,ontario,"415, water street, peterborough, ontario"
2789,211,guelph street,L7G4A8,halton hills,ontario,"211, guelph street, halton hills, ontario"
2790,131,john street s,L8N2C3,hamilton,ontario,"131, john street s, hamilton, ontario"
2791,540,huron street,N5A5T8,stratford,ontario,"540, huron street, stratford, ontario"
2792,227,second street s,P9N1G1,kenora,ontario,"227, second street s, kenora, ontario"
2793,240,grand avenue w,N7L1C1,chatham-kent,ontario,"240, grand avenue w, chatham-kent, ontario"
2794,274,huron road,N7A3A2,goderich,ontario,"274, huron road, goderich, ontario"
2795,168,king street,P0H1Z0,powassan,ontario,"168, king street, powassan, ontario"
2796,36,page street,L2R4A7,st catharines,ontario,"36, page street, st catharines, ontario"
2797,501,morris street,P1B2R9,north bay,ontario,"501, morris street, north bay, ontario"
2798,180,dundas street w,M5G1Z8,toronto,ontario,"180, dundas street w, toronto, ontario"
2799,1355,bank street,K1H8K7,ottawa,ontario,"1355, bank street, ottawa, ontario"
2800,19,king street e,N5C1G3,ingersoll,ontario,"19, king street e, ingersoll, ontario"
2801,7700,hurontario street,L6Y4M3,brampton,ontario,"7700, hurontario street, brampton, ontario"
2802,10,mackey street,P0S1K0,wawa,ontario,"10, mackey street, wawa, ontario"
2803,50,nottawasaga street,L3V3J4,orillia,ontario,"50, nottawasaga street, orillia, ontario"
2804,111,elm street,P3C1T3,sudbury,ontario,"111, elm street, sudbury, ontario"
2805,130,may street n,P7C3P2,thunder bay,ontario,"130, may street n, thunder bay, ontario"
2806,940,wilson avenue,M3K1E7,toronto,ontario,"940, wilson avenue, toronto, ontario"
2807,1,blue springs drive,N2J4M1,waterloo,ontario,"1, blue springs drive, waterloo, ontario"
2808,1400,windsor avenue,N8X3L9,windsor,ontario,"1400, windsor avenue, windsor, ontario"
2809,50,eagle street w,L3Y6B1,newmarket,ontario,"50, eagle street w, newmarket, ontario"
2811,1540,cornwall road,L6J7W5,oakville,ontario,"1540, cornwall road, oakville, ontario"
2812,648,huron street,N5Y4J8,london,ontario,"648, huron street, london, ontario"
2814,115,parkdale avenue s,L8K1H1,hamilton,ontario,"115, parkdale avenue s, hamilton, ontario"
2815,50,burnhamthorpe road,L5B3C2,mississauga,ontario,"50, burnhamthorpe road, mississauga, ontario"
2816,3210,harvester road,L7N3T1,burlington,ontario,"3210, harvester road, burlington, ontario"
2817,21,randolph avenue,M6G4G4,toronto,ontario,"21, randolph avenue, toronto, ontario"
2818,2624,dunwin drive,L5L3T5,mississauga,ontario,"2624, dunwin drive, mississauga, ontario"
2819,105,allard street,P6B5G2,sault ste marie,ontario,"105, allard street, sault ste marie, ontario"
2820,1460,fairburn street,P3A1N7,sudbury,ontario,"1460, fairburn street, sudbury, ontario"
2821,60,wilson avenue,P4N2S7,timmins,ontario,"60, wilson avenue, timmins, ontario"
2822,360,george street n,K9H7E7,peterborough,ontario,"360, george street n, peterborough, ontario"
2823,1145,barton street,P7B5N3,thunder bay,ontario,"1145, barton street, thunder bay, ontario"
2824,25,william street,N3T3K3,brantford,ontario,"25, william street, brantford, ontario"
2825,400,king street e,L8N1C3,hamilton,ontario,"400, king street e, hamilton, ontario"
2826,211,church street,L4N1W1,st catharines,ontario,"211, church street, st catharines, ontario"
2827,165,montreal road,K6H1B2,cornwall,ontario,"165, montreal road, cornwall, ontario"
2828,109,kimberley avenue n,P1L1Z8,bracebridge,ontario,"109, kimberley avenue n, bracebridge, ontario"
2829,620,university avenue,M5G2L7,toronto,ontario,"620, university avenue, toronto, ontario"
2830,135,queens plate drive,M9W6V1,toronto,ontario,"135, queens plate drive, toronto, ontario"
2832,1414,sherbrooke street,K9J0B1,peterborough,ontario,"1414, sherbrooke street, peterborough, ontario"
2833,1,canterbury place,M2N0G7,toronto,ontario,"1, canterbury place, toronto, ontario"
2834,565,sanatorium road,L9C7N4,hamilton,ontario,"565, sanatorium road, hamilton, ontario"
2835,49,young street,P0M1H0,capreol,ontario,"49, young street, capreol, ontario"
2836,3140,peter street,N9C1H3,windsor,ontario,"3140, peter street, windsor, ontario"
2838,420,highway 7 e,L4B3K2,richmond hill,ontario,"420, highway 7 e, richmond hill, ontario"
2839,300,silver star boulevard,M1V0G2,toronto,ontario,"300, silver star boulevard, toronto, ontario"
2842,300,silver star boulevard,M1V5P1,toronto,ontario,"300, silver star boulevard, toronto, ontario"
2843,425,cecelia street,K8A1S7,pembroke,ontario,"425, cecelia street, pembroke, ontario"
2844,205,amelia street,K6H3P3,cornwall,ontario,"205, amelia street, cornwall, ontario"
2845,760,belfast road,K1G6M8,ottawa,ontario,"760, belfast road, ottawa, ontario"
2846,425,cecelia street,K8A1S7,pembroke,ontario,"425, cecelia street, pembroke, ontario"
2847,700,mackay street,K8A1G6,pembroke,ontario,"700, mackay street, pembroke, ontario"
2848,306,finch avenue e,M2N4S5,toronto,ontario,"306, finch avenue e, toronto, ontario"
2849,215,eliza street,N0G1A0,arthur,ontario,"215, eliza street, arthur, ontario"
2850,12,wren drive,K0J1K0,cobden,ontario,"12, wren drive, cobden, ontario"
2851,450,queen street e,N1M2Y7,fergus,ontario,"450, queen street e, fergus, ontario"
2852,24,louise street,N0G1Z0,minto,ontario,"24, louise street, minto, ontario"
2853,240,mary street w,K9V5K5,kawartha lakes,ontario,"240, mary street w, kawartha lakes, ontario"
2854,710,reserve avenue s,N4W3H4,listowel,ontario,"710, reserve avenue s, listowel, ontario"
2855,81,fyfe avenue,N4S8Y2,woodstock,ontario,"81, fyfe avenue, woodstock, ontario"
2857,2279,laval road,K0A1E0,clarence-rockland,ontario,"2279, laval road, clarence-rockland, ontario"
2858,4850,highway 59,N0J1E0,courtland,ontario,"4850, highway 59, courtland, ontario"
2862,58,bursthall street,K0K2M0,marmora,ontario,"58, bursthall street, marmora, ontario"
2878,15,bonnie place,N5R5T8,saint thomas,ontario,"15, bonnie place, saint thomas, ontario"
2879,4,mary bucke street,N5R5J6,saint thomas,ontario,"4, mary bucke street, saint thomas, ontario"
2880,114,mclaughlin road,K9V6L1,kawartha lakes,ontario,"114, mclaughlin road, kawartha lakes, ontario"
5637,94,william street,N0B2R0,tavistock,ontario,"94, william street, tavistock, ontario"
2882,241,hanlan road,L4L3R7,vaughan,ontario,"241, hanlan road, vaughan, ontario"
2883,400,queen street s,N2G1W7,kitchener,ontario,"400, queen street s, kitchener, ontario"
2884,55,lodge road,K2C3H1,ottawa,ontario,"55, lodge road, ottawa, ontario"
2886,6,arthur street,K7C4S4,carleton place,ontario,"6, arthur street, carleton place, ontario"
2887,1125,colonel by drive,K1S5B6,ottawa,ontario,"1125, colonel by drive, ottawa, ontario"
2888,900,merivale road,K1Z5Z8,ottawa,ontario,"900, merivale road, ottawa, ontario"
2889,2330,carling avenue,K2B7H1,ottawa,ontario,"2330, carling avenue, ottawa, ontario"
2890,200,lockhart avenue,K2A4C6,ottawa,ontario,"200, lockhart avenue, ottawa, ontario"
2891,12,alma street,K7H2R7,perth,ontario,"12, alma street, perth, ontario"
2892,3305,harvester road,L7N3N2,burlington,ontario,"3305, harvester road, burlington, ontario"
2893,118,market street,L8R3P9,hamilton,ontario,"118, market street, hamilton, ontario"
2894,1530,county road 10,K0K1P0,cherry valley,ontario,"1530, county road 10, cherry valley, ontario"
2895,75,dunham drive,L9G1X7,hamilton,ontario,"75, dunham drive, hamilton, ontario"
2896,375,james street,K7G2Z1,gananoque,ontario,"375, james street, gananoque, ontario"
2897,7890,pine valley drive,L4L2J3,vaughan,ontario,"7890, pine valley drive, vaughan, ontario"
2898,28,boyd street,K0M1A0,kawartha lakes,ontario,"28, boyd street, kawartha lakes, ontario"
2899,9,huntley street,M4Y1P2,toronto,ontario,"9, huntley street, toronto, ontario"
2900,400,olive street,P1B6J4,north bay,ontario,"400, olive street, north bay, ontario"
2902,56,douglas drive,P1L0B9,bracebridge,ontario,"56, douglas drive, bracebridge, ontario"
2903,351,christie street,M6G3C3,toronto,ontario,"351, christie street, toronto, ontario"
2904,236,catherine street n,L8L4S6,hamilton,ontario,"236, catherine street n, hamilton, ontario"
2905,447,main street e,L8N1K1,hamilton,ontario,"447, main street e, hamilton, ontario"
2906,22,omeara street,K1Y4N6,ottawa,ontario,"22, omeara street, ottawa, ontario"
2907,5781,dunn street,L2G2N9,niagara falls,ontario,"5781, dunn street, niagara falls, ontario"
2908,590,lolita gardens,L5A4N8,mississauga,ontario,"590, lolita gardens, mississauga, ontario"
2911,17705,leslie street,L3Y3E3,newmarket,ontario,"17705, leslie street, newmarket, ontario"
2912,395,cedar street,N3Y2N3,simcoe,ontario,"395, cedar street, simcoe, ontario"
2913,520,markham road,M1H3A1,toronto,ontario,"520, markham road, toronto, ontario"
2914,649,king street e,L1H8P9,oshawa,ontario,"649, king street e, oshawa, ontario"
2915,260,church street,N5A2R6,stratford,ontario,"260, church street, stratford, ontario"
2916,2601,bayview avenue,M2L1B5,toronto,ontario,"2601, bayview avenue, toronto, ontario"
2917,121,morton avenue,L4P2M5,georgina,ontario,"121, morton avenue, georgina, ontario"
2918,429,walmer road,M5P2X9,toronto,ontario,"429, walmer road, toronto, ontario"
2919,860,great northern road,P6B0B5,sault ste marie,ontario,"860, great northern road, sault ste marie, ontario"
2920,500,queensway w,N3Y4R4,simcoe,ontario,"500, queensway w, simcoe, ontario"
2921,25,centennial park road,M9C5H1,toronto,ontario,"25, centennial park road, toronto, ontario"
2923,300,main street,L6V4H6,brampton,ontario,"300, main street, brampton, ontario"
2924,359,talbot street street,N5P1B7,saint thomas,ontario,"359, talbot street street, saint thomas, ontario"
2925,920,champlain court,L1N6K9,whitby,ontario,"920, champlain court, whitby, ontario"
2926,314,harwood avenue s,L1S2J1,ajax,ontario,"314, harwood avenue s, ajax, ontario"
2928,52,st lawrence street e,K0K2K0,madoc,ontario,"52, st lawrence street e, madoc, ontario"
2929,4130,glenview avenue,N0N1R0,petrolia,ontario,"4130, glenview avenue, petrolia, ontario"
2930,1100,gorham street,L3Y8Y8,newmarket,ontario,"1100, gorham street, newmarket, ontario"
2931,11,allstate parkway,L3R9T8,markham,ontario,"11, allstate parkway, markham, ontario"
2933,365,bloor street e,M4W3L4,toronto,ontario,"365, bloor street e, toronto, ontario"
2934,855,3 avenue e,N4K2K6,owen sound,ontario,"855, 3 avenue e, owen sound, ontario"
2935,65,wellesley street e,M4Y1G7,toronto,ontario,"65, wellesley street e, toronto, ontario"
2936,199,county court boulevard,L6W4P3,brampton,ontario,"199, county court boulevard, brampton, ontario"
2939,275,perrier avenue,K1L5C6,ottawa,ontario,"275, perrier avenue, ottawa, ontario"
2940,2025,rue lajoie,K0B1J0,lefaivre,ontario,"2025, rue lajoie, lefaivre, ontario"
2941,435,lemay street,K0A1N0,clarence creek,ontario,"435, lemay street, clarence creek, ontario"
2942,140,jubilee avenue w,P4N4M9,timmins,ontario,"140, jubilee avenue w, timmins, ontario"
2943,44,saint christophe street,P0M2N0,noelville,ontario,"44, saint christophe street, noelville, ontario"
2944,20,may street s,P0J1P0,temiskaming shores,ontario,"20, may street s, temiskaming shores, ontario"
2945,810,east main street,L3B5N4,welland,ontario,"810, east main street, welland, ontario"
2946,287,Bayshore drive,L4R4L1,midland,ontario,"287, Bayshore drive, midland, ontario"
2947,19,frood road,P3C4Y9,sudbury,ontario,"19, frood road, sudbury, ontario"
2948,162,murray street,K1N5M8,ottawa,ontario,"162, murray street, ottawa, ontario"
2958,955,oliver road,P7B5E1,thunder bay,ontario,"955, oliver road, thunder bay, ontario"
2959,10,victoria street s,N2G1C5,kitchener,ontario,"10, victoria street s, kitchener, ontario"
2960,2330,midland avenue,M1S5G5,toronto,ontario,"2330, midland avenue, toronto, ontario"
2961,22,college street,M5G1K3,toronto,ontario,"22, college street, toronto, ontario"
2962,635,mcewan avenue,N9B2E9,windsor,ontario,"635, mcewan avenue, windsor, ontario"
2963,420,cooper street,K2P2N6,ottawa,ontario,"420, cooper street, ottawa, ontario"
2965,9,butternut lane,L3P3M1,markham,ontario,"9, butternut lane, markham, ontario"
2966,4600,bathurst street,M2R3V2,toronto,ontario,"4600, bathurst street, toronto, ontario"
2967,4200,labelle street,K1J1J8,ottawa,ontario,"4200, labelle street, ottawa, ontario"
2968,1900,city park drive,K1J1A3,ottawa,ontario,"1900, city park drive, ottawa, ontario"
2970,65,fittons road w,L3V3V2,orillia,ontario,"65, fittons road w, orillia, ontario"
2971,1420,8 street n,P9N2S3,kenora,ontario,"1420, 8 street n, kenora, ontario"
2972,2305,pagé road,K1W1H3,ottawa,ontario,"2305, pagé road, ottawa, ontario"
2973,2,broomhead road,P0M1K0,chapleau,ontario,"2, broomhead road, chapleau, ontario"
2976,875,oullette avenue,N9A4J6,windsor,ontario,"875, oullette avenue, windsor, ontario"
2977,120,darling street,N3T5W6,brantford,ontario,"120, darling street, brantford, ontario"
2979,480,downie street,N5A7Y5,stratford,ontario,"480, downie street, stratford, ontario"
2980,32,mill street,L4G2R9,aurora,ontario,"32, mill street, aurora, ontario"
2981,1238,queen street e,M4L1C3,toronto,ontario,"1238, queen street e, toronto, ontario"
2982,465,talbot street w,N5H1K8,aylmer,ontario,"465, talbot street w, aylmer, ontario"
2983,70,station street,L1S1R9,ajax,ontario,"70, station street, ajax, ontario"
2984,71,bankside drive,N2N3L1,kitchener,ontario,"71, bankside drive, kitchener, ontario"
2985,600,chippewa street w,P1B9E7,north bay,ontario,"600, chippewa street w, north bay, ontario"
2986,450,yonge street,L4N4E2,barrie,ontario,"450, yonge street, barrie, ontario"
2987,17290,leslie street,L3Y3E1,newmarket,ontario,"17290, leslie street, newmarket, ontario"
2988,435,dundas street w,K8P1B6,belleville,ontario,"435, dundas street w, belleville, ontario"
2989,1344,belcourt boulevard,K1C1L9,ottawa,ontario,"1344, belcourt boulevard, ottawa, ontario"
2990,131,laidlaw street s,L0E1E0,cannington,ontario,"131, laidlaw street s, cannington, ontario"
2991,1182,northshore boulevard e,L7S1C5,burlington,ontario,"1182, northshore boulevard e, burlington, ontario"
2992,3998,bridle path drive,L1T4H4,ottawa,ontario,"3998, bridle path drive, ottawa, ontario"
2993,259,hillcroft street,L1G8E4,oshawa,ontario,"259, hillcroft street, oshawa, ontario"
2994,428,front road w,K0B1K0,lorignal,ontario,"428, front road w, lorignal, ontario"
2995,41,amelia street,K6H7E5,cornwall,ontario,"41, amelia street, cornwall, ontario"
2996,455,cedar street n,P4N8K4,timmins,ontario,"455, cedar street n, timmins, ontario"
2997,3131,new street,L7N3P8,burlington,ontario,"3131, new street, burlington, ontario"
2998,95,fauquier avenue,P6B2B2,sault ste marie,ontario,"95, fauquier avenue, sault ste marie, ontario"
2999,101,manning road,L1N9M2,whitby,ontario,"101, manning road, whitby, ontario"
3000,1499,stoneridge drive,K7M9H9,kingston,ontario,"1499, stoneridge drive, kingston, ontario"
