idx,street_no,street_name,postal_code,city,province,address
5704,2930,erin centre boulevard,L5M7M4,mississauga,ontario,"2930, erin centre boulevard, mississauga, ontario"
5705,3030,singleton avenue,N6L0B6,london,ontario,"3030, singleton avenue, london, ontario"
5706,2245,lawrence avenue w,M9P3W3,toronto,ontario,"2245, lawrence avenue w, toronto, ontario"
5707,60,woodlawn road e,N1H8M8,guelph,ontario,"60, woodlawn road e, guelph, ontario"
5708,425,great lakes drive,L6R2W8,brampton,ontario,"425, great lakes drive, brampton, ontario"
5709,4100,upper middle road,L7M4W8,burlington,ontario,"4100, upper middle road, burlington, ontario"
5710,3800,brock street n,L1R3A5,whitby,ontario,"3800, brock street n, whitby, ontario"
5712,695,block line road,N2E3K1,kitchener,ontario,"695, block line road, kitchener, ontario"
5157,2701,st clair avenue e,M4B3M3,toronto,ontario,"2701, st clair avenue e, toronto, ontario"
5159,30,seacliff drive e,N8H0E5,leamington,ontario,"30, seacliff drive e, leamington, ontario"
5161,100,james street huron e,N0K1W0,,ontario,"100, james street huron e, ontario"
5163,681,front road s,N9V0B4,amherstburg,ontario,"681, front road s, amherstburg, ontario"
5164,1700,essex county road 22,N0R1A0,lakeshore,ontario,"1700, essex county road 22, lakeshore, ontario"
5165,55,diana avenue,N3T0C2,brantford,ontario,"55, diana avenue, brantford, ontario"
5166,65,clarington boulevard,L1C0A1,bowmanville,ontario,"65, clarington boulevard, bowmanville, ontario"
5167,344,dufferin avenue,K8V5G9,quinte west,ontario,"344, dufferin avenue, quinte west, ontario"
5168,760,bronte street s,L9T8X4,milton,ontario,"760, bronte street s, milton, ontario"
5169,1389,16 avenue e,N4K0A9,owen sound,ontario,"1389, 16 avenue e, owen sound, ontario"
5170,2400,sandwich west parkway,N9H2S8,windsor,ontario,"2400, sandwich west parkway, windsor, ontario"
5171,8,shoreview place,L8E0J6,hamilton,ontario,"8, shoreview place, hamilton, ontario"
5172,3230,napperton drive,N7G0C4,strathroy,ontario,"3230, napperton drive, strathroy, ontario"
5173,163,first avenue,L3C0A3,welland,ontario,"163, first avenue, welland, ontario"
5174,353,pitt street,K6J3R1,cornwall,ontario,"353, pitt street, cornwall, ontario"
5176,263,wonham street s,N5C3P6,ingersoll,ontario,"263, wonham street s, ingersoll, ontario"
5177,138,main street,K0H2N0,seeleys bay,ontario,"138, main street, seeleys bay, ontario"
5178,40,st clair avenue e,M4T1M9,toronto,ontario,"40, st clair avenue e, toronto, ontario"
5179,80,grosvenor street,M7A1E9,toronto,ontario,"80, grosvenor street, toronto, ontario"
5181,707,st clair avenue w,M6C4A1,toronto,ontario,"707, st clair avenue w, toronto, ontario"
5182,140,merton street,M4S1A1,toronto,ontario,"140, merton street, toronto, ontario"
5183,3333,finch avenue e,M1W2R9,toronto,ontario,"3333, finch avenue e, toronto, ontario"
5185,10,pearl street n,L8R2Y8,hamilton,ontario,"10, pearl street n, hamilton, ontario"
5186,56,francis street,K7M1L8,kingston,ontario,"56, francis street, kingston, ontario"
5187,2030,bristol circle,L6H0H2,oakville,ontario,"2030, bristol circle, oakville, ontario"
5188,2,buchan court,M2J5A3,toronto,ontario,"2, buchan court, toronto, ontario"
5190,543,gough street,N0G2H0,lucknow,ontario,"543, gough street, lucknow, ontario"
5191,410,hurst drive,L4N6N1,barrie,ontario,"410, hurst drive, barrie, ontario"
5192,84,marlborough street n,N0P1A0,chatham-kent,ontario,"84, marlborough street n, chatham-kent, ontario"
5193,103,leopolds drive,K1V7E2,ottawa,ontario,"103, leopolds drive, ottawa, ontario"
5194,618,william street,N0G1R0,durham,ontario,"618, william street, durham, ontario"
5195,195,village road,P0P1B0,cutler,ontario,"195, village road, cutler, ontario"
5196,310,olmstead street,K1L7K3,ottawa,ontario,"310, olmstead street, ottawa, ontario"
5198,30,centre street,L9W2X3,orangeville,ontario,"30, centre street, orangeville, ontario"
5199,969,derry road e,L5T2J7,mississauga,ontario,"969, derry road e, mississauga, ontario"
5200,295,main w,K6A0B3,hawkesbury,ontario,"295, main w, hawkesbury, ontario"
5201,29,byng avenue,P5N1W6,kapuskasing,ontario,"29, byng avenue, kapuskasing, ontario"
5206,7,south street,L3V3T1,orillia,ontario,"7, south street, orillia, ontario"
5207,385,mooney street,P7B5L5,thunder bay,ontario,"385, mooney street, thunder bay, ontario"
5208,,,,quinte west,ontario,"quinte west, ontario"
5209,400,elliot avenue,K7K6M9,kingston,ontario,"400, elliot avenue, kingston, ontario"
5211,12,bartlett avenue,L3M4N5,grimsby,ontario,"12, bartlett avenue, grimsby, ontario"
5216,1005,medical centre road,K0H2P0,sharbot lake,ontario,"1005, medical centre road, sharbot lake, ontario"
5217,14244,road 38,K0H2P0,maberly,ontario,"14244, road 38, maberly, ontario"
5218,2,village road,P0G1G0,nobel,ontario,"2, village road, nobel, ontario"
5219,142,ogemah miikan,P0P1W0,sheguiandah,ontario,"142, ogemah miikan, sheguiandah, ontario"
5220,200,robert street,L9V3S1,shelburne,ontario,"200, robert street, shelburne, ontario"
5222,3760,sheppard avenue e,M1T3K9,toronto,ontario,"3760, sheppard avenue e, toronto, ontario"
5223,3758,sheppard avenue e,M1T3K9,toronto,ontario,"3758, sheppard avenue e, toronto, ontario"
5224,145,castlefrank road,K2L3X9,ottawa,ontario,"145, castlefrank road, ottawa, ontario"
5225,333,sherbourne street,M5A2S5,toronto,ontario,"333, sherbourne street, toronto, ontario"
5227,345,sherbourne street,M5A2S3,toronto,ontario,"345, sherbourne street, toronto, ontario"
5228,6,sheridan street,N3T2P6,brantford,ontario,"6, sheridan street, brantford, ontario"
5231,570,gainsborough road,N6G4X2,london,ontario,"570, gainsborough road, london, ontario"
5232,1814,county road 2 e,K6V5T1,brockville,ontario,"1814, county road 2 e, brockville, ontario"
5233,,sheshegwaning road,P0P1X0,sheshegwaning,ontario,"sheshegwaning road, sheshegwaning, ontario"
5234,161,applegrove street,P3C1N2,sudbury,ontario,"161, applegrove street, sudbury, ontario"
5235,1532,pelham street,L0S1E3,pelham,ontario,"1532, pelham street, pelham, ontario"
5272,4350,mississauga road,L5M7C8,mississauga,ontario,"4350, mississauga road, mississauga, ontario"
5381,835,west ridge boulevard,L3V8B3,orillia,ontario,"835, west ridge boulevard, orillia, ontario"
5497,1742,bristol road w,L5M1X9,mississauga,ontario,"1742, bristol road w, mississauga, ontario"
5806,800,edgar street,K7M8S4,kingston,ontario,"800, edgar street, kingston, ontario"
5821,133,kennedy road s,L6W3G3,brampton,ontario,"133, kennedy road s, brampton, ontario"
5966,401,william street,P1A1X5,north bay,ontario,"401, william street, north bay, ontario"
6038,2005,lawrence avenue w,M9N3V4,toronto,ontario,"2005, lawrence avenue w, toronto, ontario"
6091,5400,steeles avenue w,L4L9S1,vaughan,ontario,"5400, steeles avenue w, vaughan, ontario"
6093,10260,kennedy road n,L6Z4N7,brampton,ontario,"10260, kennedy road n, brampton, ontario"
5273,182,norfolk street s,N3Y2W4,simcoe,ontario,"182, norfolk street s, simcoe, ontario"
5276,44,donald street,L4N1E3,barrie,ontario,"44, donald street, barrie, ontario"
5277,1110,highway 26,L0L1X0,midhurst,ontario,"1110, highway 26, midhurst, ontario"
6050,75,fifth avenue,P8T1K9,sioux lookout,ontario,"75, fifth avenue, sioux lookout, ontario"
5291,4633,haliburton county road 21,K0M1S0,haliburton,ontario,"4633, haliburton county road 21, haliburton, ontario"
5292,220,cowan avenue,M6K2N6,toronto,ontario,"220, cowan avenue, toronto, ontario"
5293,1745,chiefswood road,N0A1M0,ohsweken,ontario,"1745, chiefswood road, ohsweken, ontario"
5296,48,lakeview drive,P0V3C0,slate falls,ontario,"48, lakeview drive, slate falls, ontario"
5297,52,abbott street n,K7A1W3,smiths falls,ontario,"52, abbott street n, smiths falls, ontario"
5298,230,canboro street,L0R2A0,smithville,ontario,"230, canboro street, smithville, ontario"
5300,90,first avenue,K1S2G4,ottawa,ontario,"90, first avenue, ottawa, ontario"
5301,10,saint mary street,M4Y1P9,toronto,ontario,"10, saint mary street, toronto, ontario"
5302,240,church street,M5B1Z2,toronto,ontario,"240, church street, toronto, ontario"
5303,733,ross avenue e,P4N8S8,timmins,ontario,"733, ross avenue e, timmins, ontario"
5304,211,bronson avenue,K1R6H5,ottawa,ontario,"211, bronson avenue, ottawa, ontario"
5305,1001,queen street w,M6J1H4,toronto,ontario,"1001, queen street w, toronto, ontario"
5306,27,medical centre road,K0J2M0,whitney,ontario,"27, medical centre road, whitney, ontario"
5319,85,pine street s,P4N2K1,timmins,ontario,"85, pine street s, timmins, ontario"
5320,1471,john counter boulevard,K7M8S8,kingston,ontario,"1471, john counter boulevard, kingston, ontario"
5321,1355,bank street,K1H8K7,ottawa,ontario,"1355, bank street, ottawa, ontario"
5322,71,adam street,K8N5K3,belleville,ontario,"71, adam street, belleville, ontario"
5324,833,coxwell avenue,M4C3E8,toronto,ontario,"833, coxwell avenue, toronto, ontario"
5325,215,talbot street e,N8H3X5,leamington,ontario,"215, talbot street e, leamington, ontario"
5328,2,gower street,M4B1E2,toronto,ontario,"2, gower street, toronto, ontario"
5329,955,queen street e,M4M3P3,toronto,ontario,"955, queen street e, toronto, ontario"
5330,356,oxford street w,N6H1T3,london,ontario,"356, oxford street w, london, ontario"
5331,201,queens avenue,N6A1J1,london,ontario,"201, queens avenue, london, ontario"
5333,1355,bank street,K1H8K7,ottawa,ontario,"1355, bank street, ottawa, ontario"
5362,135,south vickers street,P7E1J2,thunder bay,ontario,"135, south vickers street, thunder bay, ontario"
5363,2625,walsh street e,P7E2E5,thunder bay,ontario,"2625, walsh street e, thunder bay, ontario"
5364,99,shuniah street,P7A2Z2,thunder bay,ontario,"99, shuniah street, thunder bay, ontario"
5661,92,centre street,K0C1A0,alexandria,ontario,"92, centre street, alexandria, ontario"
5956,97,mill street,K0K3K0,warkworth,ontario,"97, mill street, warkworth, ontario"
6022,103,pelham road,L2S1S9,st catharines,ontario,"103, pelham road, st catharines, ontario"
5365,400,ray lawson boulevard,L6Y4G4,brampton,ontario,"400, ray lawson boulevard, brampton, ontario"
5366,4295,stagecoach road,K0H2T0,sydenham,ontario,"4295, stagecoach road, sydenham, ontario"
5367,38,park street,N9Y1N4,kingsville,ontario,"38, park street, kingsville, ontario"
5368,581,davis drive,L3Y2P6,newmarket,ontario,"581, davis drive, newmarket, ontario"
5375,640,grace street,L3Y2P6,newmarket,ontario,"640, grace street, newmarket, ontario"
5376,1025,2 avenue w,N4K4N1,owen sound,ontario,"1025, 2 avenue w, owen sound, ontario"
5377,77,anishnaabeg drive,N0L1Y0,muncey,ontario,"77, anishnaabeg drive, muncey, ontario"
5378,1230,talbot street,N5P1G9,saint thomas,ontario,"1230, talbot street, saint thomas, ontario"
5380,11118,highway 124,P0A1X0,sundridge,ontario,"11118, highway 124, sundridge, ontario"
5382,520,sutherland drive,M4G3V9,toronto,ontario,"520, sutherland drive, toronto, ontario"
5384,,bruce avenue w,P0N1H0,timmins,ontario,"bruce avenue w, timmins, ontario"
5385,643,west gore street,N5A1L4,stratford,ontario,"643, west gore street, stratford, ontario"
5388,96,kittridge avenue e,N7G2A8,strathroy,ontario,"96, kittridge avenue e, strathroy, ontario"
5389,588,queen street w,M6J1E3,toronto,ontario,"588, queen street w, toronto, ontario"
5408,4690,regional road 15,P0M1L0,sudbury,ontario,"4690, regional road 15, sudbury, ontario"
5421,1140,south bay road,P3E0B6,sudbury,ontario,"1140, south bay road, sudbury, ontario"
5444,1250,south bay road,P3E6L9,sudbury,ontario,"1250, south bay road, sudbury, ontario"
5393,99,park street,N7M3R5,chatham-kent,ontario,"99, park street, chatham-kent, ontario"
5395,255,st andrews street,N1S1P1,cambridge,ontario,"255, st andrews street, cambridge, ontario"
5396,685,finch avenue w,M2R1P2,toronto,ontario,"685, finch avenue w, toronto, ontario"
5398,30,nova crescent,L3C6P8,welland,ontario,"30, nova crescent, welland, ontario"
5402,2562,eglington avenue w,M6M1T4,toronto,ontario,"2562, eglington avenue w, toronto, ontario"
5405,60,richview road,M9A5E4,toronto,ontario,"60, richview road, toronto, ontario"
5406,391,rymal road w,L9B1V2,hamilton,ontario,"391, rymal road w, hamilton, ontario"
5409,225,st george street,M5R2M2,toronto,ontario,"225, st george street, toronto, ontario"
5410,2339,dufferin street,M6E4Z5,toronto,ontario,"2339, dufferin street, toronto, ontario"
5411,10,water street,N0B2N0,saint jacobs,ontario,"10, water street, saint jacobs, ontario"
5412,915,notre dame street,K0A1W0,embrun,ontario,"915, notre dame street, embrun, ontario"
5414,440,water street,K9J7K6,peterborough,ontario,"440, water street, peterborough, ontario"
5415,659,brealey drive,K9K2R8,peterborough,ontario,"659, brealey drive, peterborough, ontario"
5420,14,york street,K6J5T2,cornwall,ontario,"14, york street, cornwall, ontario"
5423,294,talbot street,N5P4E3,saint thomas,ontario,"294, talbot street, saint thomas, ontario"
5424,550,wellington road,N6C0A7,london,ontario,"550, wellington road, london, ontario"
5425,401,sunset drive,N5R3C6,st thomas,ontario,"401, sunset drive, st thomas, ontario"
5433,100,james street s,L8P2Z2,hamilton,ontario,"100, james street s, hamilton, ontario"
5435,2757,king street e,L8G5E4,hamilton,ontario,"2757, king street e, hamilton, ontario"
5436,1550,upper james street,L9B2L6,hamilton,ontario,"1550, upper james street, hamilton, ontario"
5437,485,windermere road,N6A5M2,london,ontario,"485, windermere road, london, ontario"
5440,99,wayne gretzky parkway,N3S6T6,brantford,ontario,"99, wayne gretzky parkway, brantford, ontario"
5441,70,spine road,P5A1X2,elliot lake,ontario,"70, spine road, elliot lake, ontario"
5442,30,the queensway,M6R1B5,toronto,ontario,"30, the queensway, toronto, ontario"
5443,56,governors road,L9H5G7,hamilton,ontario,"56, governors road, hamilton, ontario"
5454,431,dundas street e,M5A2B1,toronto,ontario,"431, dundas street e, toronto, ontario"
5455,1803,county road 2 e,K6V5T1,brockville,ontario,"1803, county road 2 e, brockville, ontario"
5456,181,ontario street,K7L5M1,kingston,ontario,"181, ontario street, kingston, ontario"
5457,12,market street,N3T5P9,brantford,ontario,"12, market street, brantford, ontario"
5458,405,dundas street,N6B1V9,london,ontario,"405, dundas street, london, ontario"
5459,225,fifth avenue,P4N0B2,timmins,ontario,"225, fifth avenue, timmins, ontario"
5461,317,james street s,N4X1A6,saint marys,ontario,"317, james street s, saint marys, ontario"
5462,707,st clair avenue w,M6C4A1,toronto,ontario,"707, st clair avenue w, toronto, ontario"
5463,785,britannia avenue,L8H2B6,hamilton,ontario,"785, britannia avenue, hamilton, ontario"
5464,277,rusholme road,M6H2Y9,toronto,ontario,"277, rusholme road, toronto, ontario"
5467,410,sherbourne street,M4X1K2,toronto,ontario,"410, sherbourne street, toronto, ontario"
5468,2865,riverside drive,K1V8N5,ottawa,ontario,"2865, riverside drive, ottawa, ontario"
5471,3333,finch avenue e,M1W2R9,toronto,ontario,"3333, finch avenue e, toronto, ontario"
5473,340,college street,M5T3A9,toronto,ontario,"340, college street, toronto, ontario"
5475,511,huron street,N5A5T8,stratford,ontario,"511, huron street, stratford, ontario"
5481,310,titan private,K2G0B1,ottawa,ontario,"310, titan private, ottawa, ontario"
5482,63,west front street,K0K3E0,stirling,ontario,"63, west front street, stirling, ontario"
5483,1354,main street n,K2S1V4,ottawa,ontario,"1354, main street n, ottawa, ontario"
5484,165,cole road,N1G4N9,guelph,ontario,"165, cole road, guelph, ontario"
5485,2398,yonge street,M4P2H4,toronto,ontario,"2398, yonge street, toronto, ontario"
5486,60,westwood road,N1H7X3,guelph,ontario,"60, westwood road, guelph, ontario"
5488,2445,lakeshore boulevard w,M8V1C5,toronto,ontario,"2445, lakeshore boulevard w, toronto, ontario"
5489,40,freel lane,L4A8B9,whitchurch-stouffville,ontario,"40, freel lane, whitchurch-stouffville, ontario"
5490,342,erie street,N5A2N4,stratford,ontario,"342, erie street, stratford, ontario"
5492,599,albert street,N7G3J3,strathroy,ontario,"599, albert street, strathroy, ontario"
5495,87,pembroke street,M5A2N9,toronto,ontario,"87, pembroke street, toronto, ontario"
5496,338,dundas street e,M5A2A1,toronto,ontario,"338, dundas street e, toronto, ontario"
5498,221,milner avenue,M1S4P4,toronto,ontario,"221, milner avenue, toronto, ontario"
5499,25,wanless avenue,M4N1V5,toronto,ontario,"25, wanless avenue, toronto, ontario"
5500,1300,paris street,P3E3A3,sudbury,ontario,"1300, paris street, sudbury, ontario"
5501,359,riverside drive,P3E1H5,sudbury,ontario,"359, riverside drive, sudbury, ontario"
5503,101,queensway w,L5B2P7,mississauga,ontario,"101, queensway w, mississauga, ontario"
5504,760,brant street,L7R4B7,burlington,ontario,"760, brant street, burlington, ontario"
5506,175,talbot street e,N8H1L9,leamington,ontario,"175, talbot street e, leamington, ontario"
5508,600,sundial drive,L3V6H3,orillia,ontario,"600, sundial drive, orillia, ontario"
5509,2075,bayview avenue,M4N3M5,toronto,ontario,"2075, bayview avenue, toronto, ontario"
5514,285,cummer avenue,M2M2G1,toronto,ontario,"285, cummer avenue, toronto, ontario"
5519,1635,dundas street e,L1N2K9,whitby,ontario,"1635, dundas street e, whitby, ontario"
5522,5401,lakeshore road,L7L6S5,burlington,ontario,"5401, lakeshore road, burlington, ontario"
5523,484,steeles avenue w,L4J0C7,vaughan,ontario,"484, steeles avenue w, vaughan, ontario"
5524,3,golf links drive,L4G7Y4,aurora,ontario,"3, golf links drive, aurora, ontario"
5525,4046,erin mills parkway,L5L2W7,mississauga,ontario,"4046, erin mills parkway, mississauga, ontario"
5526,1279,burnhamthorpe road e,L4Y3V7,mississauga,ontario,"1279, burnhamthorpe road e, mississauga, ontario"
5527,456,trafalgar road,L6J7X1,oakville,ontario,"456, trafalgar road, oakville, ontario"
5528,9800,yonge street,L4C0P5,richmond hill,ontario,"9800, yonge street, richmond hill, ontario"
5529,38,swansea road,L3R5K2,markham,ontario,"38, swansea road, markham, ontario"
5530,5065,riverside drive e,N8Y5B3,windsor,ontario,"5065, riverside drive e, windsor, ontario"
5531,75,john street w,L1H1W9,oshawa,ontario,"75, john street w, oshawa, ontario"
5532,35,wolsley street,P9N0H8,kenora,ontario,"35, wolsley street, kenora, ontario"
5533,53,long sault drive,K0C1P0,long sault,ontario,"53, long sault drive, long sault, ontario"
5535,795,eglinton avenue e,M4G4E4,toronto,ontario,"795, eglinton avenue e, toronto, ontario"
5536,765,queen street e,P6A2A8,sault ste marie,ontario,"765, queen street e, sault ste marie, ontario"
5538,201,joseph street,K8A8J2,pembroke,ontario,"201, joseph street, pembroke, ontario"
5539,348,bronte street,L9T5B6,milton,ontario,"348, bronte street, milton, ontario"
5540,245,commercial street,L9T2J3,milton,ontario,"245, commercial street, milton, ontario"
5542,328,warrington road,L0M1S0,stayner,ontario,"328, warrington road, stayner, ontario"
5543,27,weaver crescent,K2K2Z8,ottawa,ontario,"27, weaver crescent, ottawa, ontario"
5544,6419,lumberman way,K1C6E8,ottawa,ontario,"6419, lumberman way, ottawa, ontario"
5547,790,bay street,M5G1N8,toronto,ontario,"790, bay street, toronto, ontario"
5548,27,Tapscott Rd unit 1,M1B4Y7,toronto,ontario,"27, Tapscott Rd unit 1, toronto, ontario"
5550,15,summerland terrace,M9A0B5,toronto,ontario,"15, summerland terrace, toronto, ontario"
5551,843,mohawk road e,L8T2R4,hamilton,ontario,"843, mohawk road e, hamilton, ontario"
5552,,rr 2,P0L1C0,cochrane,ontario,"rr 2, cochrane, ontario"
5553,145,government road e,P2N3P4,kirkland lake,ontario,"145, government road e, kirkland lake, ontario"
5554,12421,tecumseh road e,N8N1M6,windsor,ontario,"12421, tecumseh road e, windsor, ontario"
5557,17,oconnor drive,P0H2H0,temagami,ontario,"17, oconnor drive, temagami, ontario"
5560,1020,mcnicoll avenue,M1W2J6,toronto,ontario,"1020, mcnicoll avenue, toronto, ontario"
5561,3705,bathurst street,M6A2E8,toronto,ontario,"3705, bathurst street, toronto, ontario"
5563,55,ameer avenue,M6A2Z1,toronto,ontario,"55, ameer avenue, toronto, ontario"
5564,1385,north routledge pk,N6H5N5,london,ontario,"1385, north routledge pk, london, ontario"
5565,465,grand avenue w,N7L1C5,chatham-kent,ontario,"465, grand avenue w, chatham-kent, ontario"
5566,1385,regent street s,P3E3Z1,sudbury,ontario,"1385, regent street s, sudbury, ontario"
5567,123,spadina road,M5R2T1,toronto,ontario,"123, spadina road, toronto, ontario"
5568,393,university avenue,M5G1E6,toronto,ontario,"393, university avenue, toronto, ontario"
5570,1500,rathburn road e,L4W4L7,mississauga,ontario,"1500, rathburn road e, mississauga, ontario"
5571,6,broomhead road,P0M1K0,chapleau,ontario,"6, broomhead road, chapleau, ontario"
5572,85,bridge street e,K8N1L9,belleville,ontario,"85, bridge street e, belleville, ontario"
5573,720,mount pleasant road,M4S2N4,toronto,ontario,"720, mount pleasant road, toronto, ontario"
5574,181,wellington street,N6B2K9,london,ontario,"181, wellington street, london, ontario"
5575,2227,south millway,L5L3R6,mississauga,ontario,"2227, south millway, mississauga, ontario"
5576,315,reid street,K9J3R2,peterborough,ontario,"315, reid street, peterborough, ontario"
5577,713,davis drive,L3Y2R3,newmarket,ontario,"713, davis drive, newmarket, ontario"
5578,271,spadina road,M5R2V3,toronto,ontario,"271, spadina road, toronto, ontario"
5579,300,giles boulevard e,N9A4C4,windsor,ontario,"300, giles boulevard e, windsor, ontario"
5581,908,second avenue e,N4K2H6,owen sound,ontario,"908, second avenue e, owen sound, ontario"
5582,749,baseline road e,N6C2R6,london,ontario,"749, baseline road e, london, ontario"
5583,4900,wyandotte street e,N8Y1H7,windsor,ontario,"4900, wyandotte street e, windsor, ontario"
5584,151,frederick street,N2H2M2,kitchener,ontario,"151, frederick street, kitchener, ontario"
5588,14,high street,L4N1W1,barrie,ontario,"14, high street, barrie, ontario"
5591,421,dundas street w,M8X1Y6,toronto,ontario,"421, dundas street w, toronto, ontario"
5592,416,east street n,N7T6Y4,sarnia,ontario,"416, east street n, sarnia, ontario"
5593,10,herkimer street,L8P2G2,hamilton,ontario,"10, herkimer street, hamilton, ontario"
5594,467,main street e,L8N1K1,hamilton,ontario,"467, main street e, hamilton, ontario"
5595,60,bond street e,L1G8C9,oshawa,ontario,"60, bond street e, oshawa, ontario"
5596,114,whites road,K8V5P5,quinte west,ontario,"114, whites road, quinte west, ontario"
5598,305,balliol street,M4S3H5,toronto,ontario,"305, balliol street, toronto, ontario"
5600,789,broadway street,N0N1T0,plympton-wyoming,ontario,"789, broadway street, plympton-wyoming, ontario"
5601,630,eagleson road,K2M0N1,ottawa,ontario,"630, eagleson road, ottawa, ontario"
5606,77,dunfield avenue,M4S2H3,toronto,ontario,"77, dunfield avenue, toronto, ontario"
5607,164,peter street,L1A1C6,port hope,ontario,"164, peter street, port hope, ontario"
5608,424,talbot street w,N5H1K9,aylmer,ontario,"424, talbot street w, aylmer, ontario"
5609,10,vaughan street,K1M2H6,ottawa,ontario,"10, vaughan street, ottawa, ontario"
5610,170,metcalfe street,N1E4Y3,guelph,ontario,"170, metcalfe street, guelph, ontario"
5611,170,metcalfe street,N1E4Y3,guelph,ontario,"170, metcalfe street, guelph, ontario"
5613,138,janray drive,M1G1Y9,toronto,ontario,"138, janray drive, toronto, ontario"
5615,117,banting drive,K0J1P0,deep river,ontario,"117, banting drive, deep river, ontario"
5616,1700,bloor street w,M6P4C3,toronto,ontario,"1700, bloor street w, toronto, ontario"
5617,27,forest street,P2A2R2,parry sound,ontario,"27, forest street, parry sound, ontario"
5619,170,jarvis street,M5B2B7,toronto,ontario,"170, jarvis street, toronto, ontario"
5621,166,1 avenue n,N0G1L0,chesley,ontario,"166, 1 avenue n, chesley, ontario"
5622,17,mckenzie street,K0K2K0,madoc,ontario,"17, mckenzie street, madoc, ontario"
5623,10,rhapsody crescent,L6P4E7,brampton,ontario,"10, rhapsody crescent, brampton, ontario"
5625,1195,queen street e,M4M1L6,toronto,ontario,"1195, queen street e, toronto, ontario"
5627,1150,morrison drive,K2H8S9,ottawa,ontario,"1150, morrison drive, ottawa, ontario"
5628,3560,bathurst street,M6A2E1,toronto,ontario,"3560, bathurst street, toronto, ontario"
5629,309,bridge street w,K7R2G4,napanee,ontario,"309, bridge street w, napanee, ontario"
5630,25,lakeshore road w,L6K1C6,oakville,ontario,"25, lakeshore road w, oakville, ontario"
5631,25,brunswick avenue,M5S2L9,toronto,ontario,"25, brunswick avenue, toronto, ontario"
5633,130,new densmore road,K9A5W2,cobourg,ontario,"130, new densmore road, cobourg, ontario"
5634,40,toronto street,L3Z1N6,bradford west gwillimbury,ontario,"40, toronto street, bradford west gwillimbury, ontario"
5635,300,muskoka road n,P1P1N8,gravenhurst,ontario,"300, muskoka road n, gravenhurst, ontario"
5636,230,victoria street,N6A2C2,london,ontario,"230, victoria street, london, ontario"
5638,1133,prince edward county road 5 prince edward,K0K2T0,,ontario,"1133, prince edward county road 5 prince edward, ontario"
5639,248,park street w,K0E1T0,prescott,ontario,"248, park street w, prescott, ontario"
5642,21205,pier road,N0P2P0,chatham-kent,ontario,"21205, pier road, chatham-kent, ontario"
5643,921,millwood road,M4G1X2,toronto,ontario,"921, millwood road, toronto, ontario"
5644,349,ontario street,M5A2V8,toronto,ontario,"349, ontario street, toronto, ontario"
5648,22,adelaide street w,M5H4E3,toronto,ontario,"22, adelaide street w, toronto, ontario"
5649,2395,bayview avenue,M2L1A2,toronto,ontario,"2395, bayview avenue, toronto, ontario"
5663,98,pine street,P1L1N5,bracebridge,ontario,"98, pine street, bracebridge, ontario"
5665,626,prado private,K2E0B3,ottawa,ontario,"626, prado private, ottawa, ontario"
5666,636,prado private,K2E0B6,ottawa,ontario,"636, prado private, ottawa, ontario"
5668,160,wellesley street e,M4Y1J2,toronto,ontario,"160, wellesley street e, toronto, ontario"
5671,270,doak lane,L3Y0A5,newmarket,ontario,"270, doak lane, newmarket, ontario"
5672,175,north front street,K8P4Y8,belleville,ontario,"175, north front street, belleville, ontario"
5673,18,oak street,K0C1N0,lancaster,ontario,"18, oak street, lancaster, ontario"
5674,328,dundas street w,K7R4B5,napanee,ontario,"328, dundas street w, napanee, ontario"
